{
  "format": "storyweave/slides",
  "version": 1,
  "producer": "storyweave-imagegen",
  "kind": "image",
  "title": "AI 智能客服架构 · 视觉复跑",
  "canvas": {
    "width": 2048,
    "height": 1152
  },
  "entry": "index.html",
  "slides": [
    {
      "id": "s01",
      "role": "process",
      "source": "slides/s01.png",
      "claim": "AI 客服不是单点问答，而是一条可治理的服务闭环",
      "notes": "通过。中等字号结论、统一的宋体组标题和较小的无衬线技术说明形成清楚层级；中心智能编排、左右并行能力、人工坐席与治理轨道均可读。"
    }
  ]
}
