{
  "format": "storyweave/slides",
  "version": 1,
  "producer": "storyweave-imagegen",
  "kind": "image",
  "title": "AI 客服：一条可治理的服务闭环",
  "canvas": {
    "width": 2048,
    "height": 1152
  },
  "entry": "index.html",
  "slides": [
    {
      "id": "s01",
      "role": "process",
      "source": "slides/s01.png",
      "claim": "AI 客服是一条可治理的服务闭环",
      "notes": "AI 客服是一条可治理的服务闭环"
    },
    {
      "id": "s02",
      "role": "comparison",
      "source": "slides/s02.png",
      "claim": "服务能力必须沿着同一条上下文继续",
      "notes": "服务能力必须沿着同一条上下文继续"
    },
    {
      "id": "s03",
      "role": "closing",
      "source": "slides/s03.png",
      "claim": "先让一条高频服务流程可追踪",
      "notes": "先让一条高频服务流程可追踪"
    }
  ]
}
