{
  "format": "storyweave/slides",
  "version": 1,
  "producer": "storyweave-imagegen",
  "kind": "image",
  "title": "夜间交接：同一条请求继续向前",
  "canvas": {
    "width": 2048,
    "height": 1152
  },
  "entry": "index.html",
  "slides": [
    {
      "id": "s01",
      "role": "comparison",
      "source": "slides/s01.png",
      "claim": "同一条请求，在不同现场保持同一段上下文",
      "notes": "同一条请求，在不同现场保持同一段上下文"
    },
    {
      "id": "s02",
      "role": "process",
      "source": "slides/s02.png",
      "claim": "一条请求穿过夜色，也穿过交接",
      "notes": "一条请求穿过夜色，也穿过交接"
    },
    {
      "id": "s03",
      "role": "data",
      "source": "slides/s03.png",
      "claim": "服务的连续性，先从看见现场开始",
      "notes": "服务的连续性，先从看见现场开始"
    }
  ]
}
