{
  "format": "storyweave/slides",
  "version": 1,
  "producer": "storyweave-imagegen",
  "kind": "image",
  "title": "客服体验：把关系继续下去",
  "canvas": {
    "width": 2048,
    "height": 1152
  },
  "entry": "index.html",
  "slides": [
    {
      "id": "s01",
      "role": "image-hero",
      "source": "slides/s01.png",
      "claim": "一条问题从窗口进入，也带着上下文留下",
      "notes": "一条问题从窗口进入，也带着上下文留下"
    },
    {
      "id": "s02",
      "role": "quote",
      "source": "slides/s02.png",
      "claim": "接住用户的人，不该从一句自我介绍开始",
      "notes": "接住用户的人，不该从一句自我介绍开始"
    },
    {
      "id": "s03",
      "role": "comparison",
      "source": "slides/s03.png",
      "claim": "同一件事，不要让用户重复讲两遍",
      "notes": "同一件事，不要让用户重复讲两遍"
    },
    {
      "id": "s04",
      "role": "closing",
      "source": "slides/s04.png",
      "claim": "让下一次服务接着上一次发生",
      "notes": "让下一次服务接着上一次发生"
    }
  ]
}
